tytul;powierzchnia;l_pokoi;pietro;rok_budowy;cena;miejsce;Ulica
Słoneczne 2 Pokojowe Mieszkanie na żabiance !;43.0;2;4;NaN;399000;Gdańsk Żabianka;
Top lokalizacja  Gdańsk- Wyspa Spichrzów, 3 pokoje;68.32;3;1;2015;929000;Gdańsk Stare Przedmieście; Chmielna
Mieszkanie - Gdańsk Śródmieście;58.46;3;3;2018;888592;Gdańsk Śródmieście; Panieńska
Dwu pokojowe mieszkanie w Nowym Porcie;46.0;2;1;1970;299000;Gdańsk Nowy Port; Wolności
2-pokoje z widokiem na morze osobna kuchnia;48.0;2;9;1970;425000;Gdańsk Przymorze; Piastowska
Oferta Gold Neptun Park. 50 m od plaży.;52.0;2;3;2008;1250000;Gdańsk Jelitkowo; Wypoczynkowa
Kawalerka żabianka - okazja ! Gotowa pod klucz!;31.0;1;6;1979;355000;Gdańsk Żabianka;
Mieszkanie 3-pok obok lasu, niski blok;60.5;3;1;1990;550000;Gdańsk Niedźwiednik; Góralska
Inwestycja na jasieniu!!;51.1;3;3;2012;439000;Gdańsk Szadółki; Morelowa
53m2 po remoncie/ogródek/hala garażowa (oddzielnie);53.0;3;0;2019;477000;Gdańsk Jasień; Węgrzyna
53m2 po remoncie/ogródek/hala garażowa (oddzielnie);53.0;3;0;2019;477000;Gdańsk Jasień; Węgrzyna
Sprzedam 3 pokojowe mieszkanie 63,57 m2 nad Motławą.;63.57;3;1;1902;599000;Gdańsk Śródmieście;
Mieszkanie - Gdańsk Łostowice;60.7;3;0;2018;550000;Gdańsk Łostowice; Niepołomicka
UWAGA 1 pok, tramwaj, SKM, n.blok Przymorze!;30.0;1;2;1971;305000;Gdańsk Przymorze; Chłopska
Mieszkanie Gdańsk Przymorze  38 m2;38.0;3;5;1980;399000;Gdańsk Przymorze;
Apartament w centrum Gdańska- Szafarnia;93.6;4;2;2008;1040000;Gdańsk Długie Ogrody; Szafarnia
Elegancki Apartament  Bastion Wałowa 17 piętro;44.0;2;17;2018;645000;Gdańsk Śródmieście; Wałowa
Zainwestuj i zamieszkaj lub wynajmuj!;40.1;2;3;2012;459000;Gdańsk Morena; Czesława Miłosza
Mieszkanie - Gdańsk Zakoniczyn;108.5;4;0;2010;739000;Gdańsk Zakoniczyn; Jaworzniaków
Nowa Letnica - mieszkanie 3 pokojowe!;48.94;2;12;2020;499000;Gdańsk Letnica; Starowiejska
3 pok. z możliwością zrobienia 4! Ogród ok.200 m2!;48.1;3;0;1937;570000;Gdańsk Siedlce; Skarpowa
Mieszkanie 2 pokojowe z widokiem - Stare Miasto!;46.16;2;5;2017;650000;Gdańsk Stare Przedmieście; Chmielna
Dla rodziny lub inwestycyjne, 2 mieszkania w 1;110.33;5;2;1920;799000;Gdańsk Wrzeszcz;
Mieszkanie Gdańsk Przymorze Rzeczypospolitej 36.3 m2;36.3;2;2;NaN;349000;Gdańsk Przymorze; Rzeczypospolitej
Sprzedam mieszkanie 2-pokojowe Gdańsk VII Dwór;46.0;2;9;1959;500000;Gdańsk Oliwa; Rodakowskiego 1
Mieszkanie - Gdańsk Oliwa;72.0;3;3;2006;850000;Gdańsk Oliwa; Wita Stwosza
Mieszkanie na sprzedaż, Gdańsk, Jasień, 2 pokoje, 40,34 mkw, za 342890 zł. Kup Bez Prowizji!;40.34;2;1;NaN;342890;Gdańsk Ujeścisko; Jabłoniowa
Mieszkanie na sprzedaż, Gdańsk, Przymorze, 1 pokój, 17 mkw, za 239000 zł. Kup Bez Prowizji!;17.0;1;9;1970;239000;Gdańsk Przymorze; Jagiellońska
Mieszkanie na sprzedaż, Gdańsk, Łostowice, 5 pokoi, 79,22 mkw, za 599000 zł. Kup Bez Prowizji!;79.22;5;3;2012;599000;Gdańsk Łostowice; Kielasa
Mieszkanie Gdańsk Wrzeszcz  68 m2;68.0;4;1;2020;890000;Gdańsk Wrzeszcz;
Mieszkanie - Gdańsk Przymorze, 399 000 zł;43.0;2;4;1970;399000;Gdańsk Przymorze; Kołobrzeska
Przyjdź i zaproponuj swoją cenę;96.0;3;4;1994;735000;Gdańsk Suchanino; Cygańska Góra
Wyjątkowe mieszkanie na Głównym Mieście;36.36;2;0;1960;459000;Gdańsk Śródmieście; Złotników
Pięknie urządzone mieszkanie- Kameralne Nova Oliwa;70.0;3;3;2007;835000;Gdańsk Przymorze; Gen. Bora-Komorowskiego
Apartament- 2 pokoje- Nowe Osiedle- Przymorze;50.37;2;1;2017;569000;Gdańsk Przymorze; Rzeczypospolitej
Niespełna 100 m2 w sercu starej Oliwy!;94.6;4;2;1920;849000;gdańsk Oliwa;
Mieszkanie - Gdańsk Ujeścisko;71.2;4;0;1992;599999;Gdańsk Ujeścisko; Ciechanowska
Kawalerka na Żabiance- Gospody! Niski czynsz!;24.0;1;3;1980;298000;Gdańsk Żabianka; Gospody
Mieszkanie - Gdańsk Jasień;49.0;2;1;2014;429000;Gdańsk Jasień; Guderskiego Konrada
Przytulne, jasne M3 otoczone zielenią.;64.0;3;3;2000;466900;Gdańsk Osowa; Antygony
Mieszkanie Gdańsk Śródmieście ul.łagiewniki;50.29;3;2;1956;599000;Gdańsk Śródmieście; Łagiewniki
Ekskluzywny Apartament na Wyspie Spichrzów;59.0;2;3;2017;690000;Gdańsk Stare Przedmieście; Chmielna
Mieszkanie Gdańsk Orunia Górna ul.Uranowa;78.0;3;3;1992;529000;Gdańsk Orunia Górna; Uranowa
Mieszkanie 3 pok.Gdańsk Morena ul.Warneńska;59.2;3;2;1980;469000;Gdańsk Morena; Warneńska
Mieszkanie w domu wolnostojącym w sercu oliwy;159.85;6;0;1964;950000;Gdańsk Oliwa; Jelenia
Zamieszkaj w przytulnym 3 pokojowym mieszkaniu w spokojnej dzielnicy Gdańsk Osowa;53.0;3;2;2013;460000;Gdańsk Osowa; Zeusa
Zamieszkaj przy plaży z dala od miejskiego zgiełku;49.49;3;0;NaN;470000;Gdańsk Śródmieście; Kwiatowa
Jasne,przestronne, dobrze skomunikowane mieszkanie;63.7;3;4;2011;580000;Gdańsk Kiełpinek; Przytulna
Zamieszkaj przy plaży z dala od miejskiego zgiełku;35.6;2;1;NaN;347000;Gdańsk Śródmieście; Kwiatowa
Blisko centrum w drugiej linii zabudowy!;44.53;2;2;1945;356000;Gdańsk Siedlce; Zagrodowa
Zamieszkaj przy plaży z dala od miejskiego zgiełku;58.32;3;2;NaN;536000;Gdańsk Śródmieście; Kwiatowa
Gdańsk Wrzeszcz-2-pok ul.Marynarki Polskiej;41.6;2;6;1973;399000;Gdańsk Wrzeszcz; Marynarki Polskiej
Mieszkanie - Gdańsk Siedlce;48.6;3;1;1950;399000;Gdańsk Siedlce; Kartuska
Mieszkanie - Gdańsk Chełm;53.34;3;0;2008;459000;Gdańsk Ujeścisko; Anny Jagiellonki
Gdańsk Oliwa - urokliwy dom , doskonała lokalizacja;300.0;6;1;1911;2490000;Gdańsk Oliwa; Bitwy Oliwskiej
Wyjątkowa lokalizacja 151m2 Gdańsk Oliwa ogród;151.21;5;0;1900;1400000;Gdańsk Oliwa; Alfa Liczmańskiego
Dwa pokoje z osobną kuchnią na Ujeścisku !;49.6;2;2;2001;380000;Gdańsk Ujeścisko; Częstochowska
Gdańsk Wrzeszcz, 42,2m2, 2 pok, piwnica, parking !;42.2;2;2;1958;439000;Gdańsk Wrzeszcz; Grunwaldzka
Apartament w centrum Gdańska nad Motławą;140.0;3;4;2019;1540000;Gdańsk Stare Przedmieście; Kotwiczników
3 gotowe kawalerki - gdańsk śródmieście;55.68;3;1;1894;640000;Gdańsk Długie Ogrody; Mariana Seredyńskiego
Wrzeszcz - niepowtarzalna okazja inwestycyjna;140.0;4;1;1906;1400000;Gdańsk Wrzeszcz; Jana Kochanowskiego
Przestronne słoneczne 4 pokoje Chełm lokalizacja;74.78;4;1;1990;610000;Gdańsk Chełm; Reformacka
Ulica Ogarna - mieszkanie cztery pokoje;65.0;4;4;1959;714000;Gdańsk Śródmieście; Ogarna
Apartament nad Motławą z widokiem na Żurawia;65.5;3;3;2019;1270000;Gdańsk Śródmieście; Chmielna
Trzy pokoje z widokiem na las Wyposażenie w cenie!;58.5;3;2;2012;545000;Gdańsk Kiełpinek; Przytulna
Gdańsk Przymorze 2 pokoje w pasie nadmorskim !;38.0;2;2;1970;410000;Gdańsk Przymorze; Kołobrzeska
Mieszkanie - Gdańsk Przymorze;54.0;3;1;1975;465000;Gdańsk Przymorze; Kołobrzeska
Mieszkanie - Gdańsk Śródmieście;53.54;3;4;2019;642480;Gdańsk Długie Ogrody; Długie Ogrody
Mieszkanie przy Starym Mieście, oddzielna, jasna k;48.85;2;1;1962;399999;Gdańsk Stare Przedmieście; Rzeźnicka
Rodzinne mieszkanie blisko natury z bdb. dojazdem;53.9;2;2;2010;469000;Gdańsk Kiełpinek; Przytulna
Dwupokojowe mieszkanie na Przymorzu!!;45.0;2;2;1979;429000;Gdańsk Przymorze; Kołobrzeska
Ustawne 3-pokoje z balkonem, dwa miejsca postojowe;51.1;3;3;2012;439000;Gdańsk Szadółki; Morelowa
Gdańsk Przymorze. Dwa pokoje w świetnej cenie;46.0;2;0;1978;399000;Gdańsk Przymorze; Obrońców Wybrzeża
3 pokoje z dużym balkonem blisko centrum!;61.27;3;4;1990;469000;Gdańsk Orunia Górna; Krzemowa
3 pokojowe mieszkanie na Przymorzu;65.0;3;11;1970;650000;Gdańsk Przymorze; Obrońców Wybrzeża
"Gdańsk &#8211; znakomita inwestycja przy Parku Reagana";45.0;2;2;2013;560000;Gdańsk Zaspa; Jana Pawła Ii
Zarabiaj na wynajmie od zaraz centrum!!!;40.47;2;2;1955;739000;Gdańsk Śródmieście; Ogarna
3 pok. 60m. I piętro niski blok, Niedźwiednik świetny dojazd.;60.0;3;1;1990;550000;Gdańsk Niedźwiednik; Góralska
Atrakcyjne mieszkanie 4 pokojowe w super lokalizacji Gdańsk;90.0;4;3;2004;560000;Gdańsk Łostowice; Olimpijska
Wrzeszcz Apartamentowiec Idealne 3 pokoje;52.6;3;1;2019;699000;Gdańsk Morena; Ignacego Matuszewskiego
Słoneczne  3 pokoje na Suchaninie;52.3;3;2;1975;449000;Gdańsk Suchanino; Karola Kurpińskiego
Piękne mieszkanie z widokiem na morze;46.0;2;8;NaN;415000;Gdańsk Przymorze; Jagiellońska
2 pok. na Przymorzu w niskiej zabudowie;38.0;2;3;1970;419000;Gdańsk Przymorze; Jagiellońska
Kameralny Apartament na terenie Browaru Gdańskiego;63.2;3;1;2020;759000;Gdańsk Wrzeszcz; Joachima Lelewela
Duże mieszkanie w sercu Starej Oliwy;95.0;4;2;1920;849000;Gdańsk Oliwa; Kaprów
Gdańsk, Przymorze, ul. Chłopska;45.0;2;4;1970;440000;Gdańsk Przymorze; Chłopska
Mieszkanie w centrum Wrzeszcza po kapitalnym remoncie;54.3;2;3;1950;575000;Gdańsk Wrzeszcz; Grunwaldzka
3 pokoje blisko plaży, gdańsk żabianka;45.38;3;3;1967;437000;Gdańsk Żabianka; Jakuba Wejhera
Mieszkanie na Niedźwiedniku;60.0;3;1;1990;550000;Gdańsk Niedźwiednik;
Mieszkanie po generalnym remoncie Gdańsk Wrzeszcz;54.3;2;3;1950;575000;Gdańsk Wrzeszcz; Grunwaldzka
Mieszkanie 4 pokojowe Morena!;61.65;4;5;1970;519000;Gdańsk Morena; Marusarzówny 7
Słoneczne 2-pokojowe mieszkanie na Przymorzu;38.0;2;3;1970;419000;Gdańsk Przymorze; Jagiellońska
Gotowe do zamieszania 2 pokoje Gdańsk Łostowice;50.9;2;3;2017;399000;Gdańsk Łostowice; Hokejowa
Gotowe do zamieszkania - idealna lokalizacja!;38.0;3;4;NaN;398000;Gdańsk Przymorze; Piastowska
Mieszkanie z ogrodem idealne dla rodziny z dziećmi;63.3;3;0;2008;540000;Gdańsk Kiełpinek; Sympatyczna
Mieszkanie 3 pokoje - bezpośrednio;55.0;3;2;2020;379000;Gdańsk Ujeścisko; Pastelowa
Słonecznka kawalerka na przymorzu;17.0;1;9;NaN;269000;Gdańsk Przymorze; Obrońców Wybrzeża
Mieszkanie 3 pokoje lokalizacja las Strzyża;54.4;3;3;1966;580000;Gdańsk VII Dwór; Henryka Rodakowskiego
Mieszkanie 2-pok blisko morza;50.0;2;8;1974;410000;Gdańsk Przymorze; Jagiellońska
Nowe bud. 30m2 pod klucz granica Zaspa/Wrzeszcz;30.0;1;5;2007;360000;Gdańsk Wrzeszcz;
Apartament 84m2, Św. Barbary, piękny widok na park;84.0;4;1;2019;799000;Gdańsk Śródmieście; Świętej Barbary
Apartament 68m2, piękny narożny ogród, widok na park, Św. Barbary;68.0;4;0;2019;699000;Gdańsk Śródmieście; Świętej Barbary
Nowa Letnica - mieszkanie 3 pokojowe!;48.94;3;12;2020;500000;Gdańsk Letnica; Starowiejska
Przestronne mieszkanie na gdańskim Chełmie!;74.78;3;1;1991;599000;Gdańsk Chełm; Reformacka
"Gdańsk-Morena 73m; 4 pokoje; do remontu";73.0;4;4;1980;470000;Gdańsk Morena; Budapesztańska 6E
Gdańsk Brzeźno Aparatment Baltica Towers dwa pokoje p.8 Bałtyk;55.54;2;8;2019;699900;Gdańsk Brzeźno; Hallera 223
Kawalerka blisko Mariny idealna na inwestycję;34.3;1;2;2020;365000;Gdańsk Długie Ogrody; Sienna Grobla
Kawalerka blisko Mariny idealna na inwestycję;34.1;1;1;2020;365000;Gdańsk Długie Ogrody; Sienna Grobla
WaterLane - Apartament Na Sprzedaż!;53.5;2;4;2012;840000;Gdańsk Długie Ogrody; Szafarnia
Komfortowy Apartament  Na Sprzedaż - 4 Pokoje!;120.0;4;2;2009;1488000;Gdańsk Długie Ogrody; Szafarnia
Apartament z ogrodem i tarasem;99.5;3;0;2003;950000;Gdańsk Orunia Górna; Knyszyńska 8
Duża kawalerka po remoncie;33.0;1;1;2006;310000;Gdańsk Zakoniczyn; Kłoczkowskiego 1
2-pokoje, Gdańsk os. Słoneczna Morena;43.92;2;3;2013;462000;Gdańsk Morena; Czesława Miłosza 49
Zabezpiecz swoją przyszłość i kup mieszkanie na wynajem;73.0;6;1;1980;577000;Gdańsk; Amundsena 5
3-pokojowe mieszkanie blisko morza!;49.0;3;1;1970;465000;Gdańsk Żabianka; Orłowska
Sprzedam mieszkanie deweloperskie;38.59;2;0;2020;340000;Gdańsk;
Mieszkanie 2-pok we Wrzeszczu obok os. Garnizon;41.92;2;3;1975;460000;Gdańsk Wrzeszcz; Reymonta
Sprzedam mieszkanie dwupokojowe z balkonem Gdańsk Siedlce;40.0;2;1;1950;320000;Gdańsk Siedlce;
Mieszkanie 2-pok we Wrzeszczu obok os. Garnizon;41.92;2;3;1975;460000;Gdańsk Wrzeszcz; Reymonta
Morena / 3 pokoje/ pd-zach/ winda/ klima/ garaż,;63.0;3;3;2012;597000;Gdańsk Jasień; Myśliwskie Wzgórze
Mieszkanie w dobrej lokalizacji.;63.5;3;5;1953;450000;Gdańsk Siedlce; Kartuska
Gdańsk Ujeścisko 2 pokoje;40.0;2;0;2020;359000;Gdańsk Ujeścisko; Łódzka
3 - pokojowe mieszkanie w świetnej lokalizacji!;74.5;3;2;2006;920000;Gdańsk Zaspa; Skarżyńskiego
Mieszkanie na Przymorzu;55.0;3;9;1971;522500;Gdańsk Przymorze;
62m2 3pokoje przy Parku Reagana Gdańsk Przymorze;61.7;3;6;1975;499000;Gdańsk Przymorze; Kołobrzeska
Mieszkanie;40.0;2;0;2018;297000;Gdańsk Orunia Górna; Niepołomnicka 34
Mieszkanie 3 pokojowe - Orunia Górna;65.35;3;3;1995;480000;Gdańsk Orunia Górna; Dywizji Wołyńskiej
2 pokojowe od zaraz! Morena;54.0;2;2;2016;565000;Gdańsk Piecki-Migowo; Myśliwska
Mieszkanie dwupokojowe 53 m;53.4;2;1;1930;399000;Gdańsk Siedlce;
Morenowe wzgórze/Wyjątkowe 2 Pokojowe Mieszkanie;47.4;2;2;2009;449000;Gdańsk Morena; Morenowe Wzgórze
Morenowe wzgórze/Wyjątkowe 2 Pokojowe Mieszkanie;47.4;2;2;2009;449000;Gdańsk Morena; Morenowe Wzgórze
Zjawiskowe mieszkanie z widokiem na Motławę!;40.0;2;3;2017;640000;Gdańsk Stare Przedmieście; Jaglana
Kameralny Apartament z widokiem na Motławę;56.6;3;5;2012;800000;Gdańsk Stare Przedmieście; Toruńska
Mieszkanie inwestycyjne wśród zieleni;43.0;2;0;2019;390000;Gdańsk Chełm; Niepołomicka
3 pokojowy apartament z dużym tarasem i miejscem w hali;54.0;3;3;2019;469953;Gdańsk Chełm; Niepołomicka
Mieszkanie 2-pokojowe 44 m2 z osobną kuchnią;44.03;2;3;2020;351900;Gdańsk Jasień; Tadeusza Jasińskiego
Przymorze, po remoncie,33m2;33.0;2;0;1975;425000;Gdańsk Przymorze; Rzeczypospolitej
Żabianka, remont, 4pokoje;63.2;4;4;1975;536000;Gdańsk Żabianka; Sztormowa
Apartament na terenie Mariny Jachtowej;52.42;3;0;2020;750000;Gdańsk Śródmieście;
Słowackiego 4 pokoje na Inwestycję;60.6;4;1;1975;585000;Gdańsk Wrzeszcz; Słowackiego Juliusza
Mieszkanie - Gdańsk Wrzeszcz;44.4;2;1;1965;399000;Gdańsk Wrzeszcz; De Gaullea Charlsa
Nowe 2 pokojowe, Śródmieście;36.0;2;1;2019;513300;Gdańsk Śródmieście; Toruńska
2 pokoje blisko plaży | gotowe do wprowadzenia;44.5;2;5;2018;615000;Gdańsk Zaspa;
Luksusowy apartament w prestiżowej lokalizacji;125.4;4;2;NaN;2508000;Gdańsk Brzeźno; Nadmorski Dwór
Przestronne 2 pokoje z potencjałem blisko morza;58.0;2;4;1980;559000;Gdańsk Żabianka; Subisława
2 pokojowe mieszkanie w Gdańsku poniżej 200 tysięcy!;28.040;2;1;1960;205000;Gdańsk ;zalesie 3
2 niezależne pokoje Brzeźno;50.2;2;1;1961;497000;Gdańsk Brzeźno; Emilii Plater
2 Pokoje Gdańsk Jelitkowo Okazja;42.0;2;1;1966;389000;Gdańsk Jelitkowo;
Kawalerka z pięknym widokiem!;20.0;1;9;1978;269000;Gdańsk Przymorze; Obrońców Wybrzeża
Przymorze Jelitkowo gotowiec;38.0;3;5;1970;398000;Gdańsk Przymorze; Piastowska 90A
Mieszkanie - Gdańsk Wrzeszcz;53.64;3;3;1955;490000;Gdańsk Wrzeszcz; Tadeusza Kościuszki
Nowoczesne 3 pokoje z balkonem;65.0;3;2;2009;489000;Gdańsk Łostowice; Hokejowa
Mieszkanie 110m | Wrzeszczu | Moż. podziału na dwa;110.0;5;1;1920;805000;Gdańsk Wrzeszcz; Ludwika Waryńskiego
3 pok Apartament 3 min od morza !;78.5;3;3;2009;1530750;Gdańsk Jelitkowo; Wypoczynkowa
Jasne 3 pokoje do własnej aranżacji!;41.2;3;2;1930;288000;Gdańsk Nowy Port; Wolności
Mieszkanie - Gdańsk Chełm;35.0;2;2;2002;369000;Gdańsk Ujeścisko; Nieborowska
Osiedle Foresta I Zielony taras na dachu I 4 pok;122.5;4;3;2020;998500;Gdańsk Morena; Myśliwska
Mieszkanie do remontu, w urokliwej kamienicy;61.9;3;2;1954;489000;Gdańsk Wrzeszcz; Kościuszki 56
Nowoczesne mieszkanie w cichej okolicy;70.0;3;1;2011;499000;Gdańsk Św. Wojciech; Władysława Jagiełły
APARTAMENT GDAŃSKA WYSPA SPICHRZÓW;43.4;2;5;2017;849978;Gdańsk Śródmieście;
55m2 niespełna 1km od Głównego Miasta!;55.19;2;2;NaN;470000;Gdańsk Stare Przedmieście; Dolna Brama
Piękne mieszkanie w spokojnej dzielnicy Gdańska.;65.02;3;1;NaN;549000;Gdańsk Łostowice;
PIĘKNY APARTAMENT NA GDAŃSKIEJ STARÓWCE;42.4;2;3;2017;811377;Gdańsk Śródmieście;
Wszechstronne mieszkanie w centrum Wrzeszcza;66.0;3;1;1982;560000;Gdańsk Wrzeszcz; Tadeusza Kościuszki
Komfortowe mieszkanie na gdańskim Przymorzu dla dużej rodziny;79.0;3;1;1960;698000;Gdańsk Przymorze; Krzywoustego
3 pokoje Gdańsk Lawendowe Wzgórze;59.41;3;0;2015;539000;Gdańsk Szadółki; Lawendowe Wzgórze
Zadbane 4-pokojowe mieszkanie na osiedlu 4 Pory Roku;78.7;4;3;2007;499000;Gdańsk Łostowice; Jana Kielasa
Gdańsk Zaspa 3 Pok. Balkon!!! Świetna Lokalizacja!;65.0;3;4;1991;579000;Gdańsk Zaspa; Stanisława Skarżyńskiego
Dwa pokoje w Świetnej lokalizacji;39.0;2;0;1950;360000;Gdańsk Stare Przedmieście; Kotwiczników
Gdańsk Wrzeszcz-mieszkanie idealne pod inwestycję;42.7;2;3;NaN;480000;Gdańsk Wrzeszcz;
Mieszkanie - Gdańsk Stare Miasto;54.0;3;2;1956;905000;Gdańsk Śródmieście; Chlebnicka
Mieszkanie - Gdańsk Śródmieście;26.030;1;3;2014;499000;Gdańsk Śródmieście; Tartaczna
Trzypokojowe mieszkanie na osiedlu Wiszące Ogrody!;59.0;3;2;2006;529000;Gdańsk Kiełpinek; Przytulna
Mieszkanie - Gdańsk Stare Miasto, 1 930 000 zł;60.25;3;0;1950;1930000;Gdańsk Śródmieście; Mariacka
62m2 - 3 pokojowe Mieszkanie Morena-Matemblewo;62.0;3;2;1992;560000;Gdańsk Morena;
Mieszkanie lub lokal usługowy! Spacerem do morza!;46.0;2;0;1970;420000;Gdańsk Przymorze; Kołobrzeska
Mieszkanie z kominkiem w świetnej lokalizacji;52.5;2;1;NaN;529000;Gdańsk Siedlce; Wesoła
Przestronna kawalerka z widokiem!;33.0;1;2;2008;299000;Gdańsk Ujeścisko; Jeleniogórska
Mieszkanie - Gdańsk Przymorze;38.0;2;1;1970;380000;Gdańsk Przymorze; Jagiellońska
4-pokojowe mieszkanie we Wrzeszczu!;73.0;4;4;1955;650000;Gdańsk Wrzeszcz; Tadeusza Kościuszki
Okazja! Stylowe 3 pokoje pod klucz Przymorze!;38.0;3;4;1975;399000;Gdańsk Przymorze;
3pokojowy gotowiec blisko morza i parku Regana;38.0;2;4;1980;399000;Gdańsk Przymorze; Piastowska
3 POKOJE PIECKI - MIGOWO 58,5 m2! PIĘKNY WIDOK;58.5;3;3;2006;529000;Gdańsk Kiełpinek; Przytulna
3-pokojowe mieszkanie w atrakcyjnej cenie!;47.7;3;8;1977;360000;Gdańsk Orunia; Granitowa
Mieszkanie trzy pokoje na sprzedaż;67.0;3;1;1900;460000;Gdańsk Stare Przedmieście; Na Stoku
Mieszkanie - Gdańsk Przymorze;46.0;2;0;1975;399000;Gdańsk Przymorze; Obrońców Wybrzeża
3 pokoje na Morenowym Wzgórzu na ogrodzonym osiedlu, Gdańsk;94.9;3;3;2005;540000;Gdańsk Morena;
2 dwupokojowe mieszkania inwestycyjne;59.68;4;3;1955;549000;Gdańsk Siedlce; Kartuska
3 pokoje z ogródkiem na Oruni Górnej;53.34;3;0;NaN;459000;Gdańsk Ujeścisko; Anny Jagiellonki
Kawalerka 700 m od Parku Regana;19.0;1;3;1975;245000;Gdańsk Przymorze; Chłopska
Osobna kuchnia z oknem, łazienka z oknem;68.7;3;0;1999;535000;Gdańsk Osowa; Daru Pomorza
3 pokojowe z balkonem Wrzeszcz;54.0;3;3;1966;580000;Gdańsk VII Dwór; Rodakowskiego
Mieszkanie 2-pokojowe zarabiające na siebie;29.0;2;3;1955;274500;Gdańsk Siedlce; Kartuska
Gdańsk - 2 pokoje - TANIO !;29.41;2;1;1970;230000;Gdańsk Przeróbka; Joachima Pastoriusza
Sprzedam mieszkanie;40.0;2;3;2017;640000;Gdańsk Śródmieście; Jaglana
3-pokojowe słoneczne z ogrodem ,Cena do negocjacji;54.0;3;0;2008;459000;Gdańsk Chełm; Anny Jagielonki
Piękne mieszkanie- blisko morza !;54.0;3;3;2005;795000;Gdańsk Przymorze; Jelitkowski Dwór
3-pokojowe słoneczne mieszkanie w centrum Gdańska;46.5;3;2;NaN;470000;Gdańsk Biskupia Górka; Spadzista
Super 3- pokojowe z ogrodem ,Cena do negocjacji !;54.0;3;0;2008;459000;Gdańsk Chełm; Jagiellonki
2 pokoje/ Blisko morza i komunikacji- Hit Oferta!;50.37;2;1;2017;569000;Gdańsk Zaspa; Rzeczypospolitej
Mieszkanie 2-pokojowez po remoncie;37.2;2;9;1969;314000;Gdańsk Orunia Górna; Granitowa
OKAZJA 2-POK. PO REMONCIE PRZYMORZE;46.0;2;0;NaN;399000;Gdańsk Przymorze; Obrońców Wybrzeża
Centrum Przymorza-po generalnym remoncie- HIT!;62.4;5;2;1980;545000;Gdańsk Przymorze; Lęborska
Mieszkanie 3 pokojowe z balkonem;62.7;3;2;1984;540000;Gdańsk Wrzeszcz;
4 pokojowe w niskiej zabudowie na Chełmie.;72.2;4;3;1990;458000;Gdańsk Chełm; Reformacka
Mieszkanie - Gdańsk;51.0;2;2;2010;601800;Gdańsk Wrzeszcz; Gen. Józefa Hallera
Z dużym salonem, w spokojnej, zielonej okolicy;51.09;2;3;2012;579000;Gdańsk Morena; Myśliwska
Jak szybko potrafisz dojechać zanim to mieszkanie zniknie?;63.4;3;1;1990;450000;Gdańsk Chełm; Cebertowicza 17
KAWALERKA W BRZEŹNIE;26.0;1;0;1970;319000;Gdańsk Brzeźno; Dworska
Apartament na terenie Mariny Jachtowej;52.65;3;1;2020;732000;Gdańsk Śródmieście;
Atrakcyjne mieszkanie z pięknym widokiem;68.2;3;2;2010;499000;Gdańsk Zakoniczyn; Guderskiego 34
Mieszkanie - Gdańsk;76.0;2;2;NaN;849000;Gdańsk Wrzeszcz;
Posiadamy na sprzedaż bardzo atrakcyjny apartament;40.0;2;1;2016;545000;Gdańsk Przymorze; Beniowskiego
42m2 z widokiem na wodę w nadmorskiej dzielnicy!;42.89;2;4;1972;330000;Gdańsk Stogi; Tamka
Przytulne mieszkanie blisko obwodnicy i lasu;44.0;2;0;NaN;295000;Gdańsk Matarnia - Rębiechowo;
Wyjątkowe mieszkanie w spokojnej okolicy;53.7;3;3;NaN;440000;Gdańsk Kowale; Heliosa
Mieszkanie 3-pok. na Zaspie, niski blok;60.0;3;2;1984;479000;Gdańsk Zaspa; Leszczyńskich
4 pokoje, Żabianka, remont;63.2;4;4;1975;536000;Gdańsk Żabianka; Sztormowa
Przestronne mieszkanie 2-pok, niski blok;49.3;2;1;1970;485000;Gdańsk Wrzeszcz; Sochaczewska
Mieszkanie 2-pok obok parku Reagana;38.0;2;1;1969;380000;Gdańsk Przymorze; Jagiellońska
3-pokojowe z tarasem i ogrodem blisko Centrum;53.0;3;0;2008;459000;Gdańsk Ujeścisko; Anny Jagiellonki
Gdańsk ,Pełny komfort ! Daj się zaskoczyć !;90.72;4;3;2009;560000;Gdańsk Łostowice; Olimpijska
Mieszkanie - Gdańsk Morena;73.8;4;2;2006;599000;Gdańsk Morena; Morenowe Wzgórze
Mieszkanie - Gdańsk Chełm;51.17;2;3;2008;450000;Gdańsk Chełm; Prof. Stanisława Szpora
3 pokoje po remoncie super lokalizacja;50.0;3;1;1980;479000;Gdańsk Morena; Ignacego Matuszewskiego
Wyposażenie i miejsce postojowe wliczone w cenę!;42.0;2;0;2019;649000;Gdańsk Długie Ogrody;
Idealna inwestycja: do podziału na 2 kawalerki!;49.0;3;1;1962;399000;Gdańsk Stare Przedmieście; Rzeźnicka
3 pokoje/ Alfa Park/ hala garażowa/ winda/ bez pośredników/;52.7;3;3;2016;519000;Gdańsk Morena; Myśliwska
Mieszkanie - Gdańsk Wrzeszcz;45.0;3;4;1964;365000;Gdańsk Młyniska; Mikołaja Reja
HIT! Przestronne 3pok. przy G.Bałtyckiej,Wrzeszcz;80.0;3;3;1958;699000;Gdańsk Wrzeszcz; Antoniego Lendziona
Zamieszkaj w centrum Wrzeszcza!;80.0;3;3;1950;699000;Gdańsk Wrzeszcz; Antoniego Lendziona
Kameralne mieszkanie z duszą w sercu Starówki;55.0;3;2;1956;715000;Gdańsk Śródmieście; Kozia
Mieszkanie Gdańsk Śródmieście  52 m2;52.0;2;3;2013;845000;Gdańsk Śródmieście;
Dwupoziomowy 5 pokoi tarasy garaż blisko centrum;106.0;5;2;2010;899000;Gdańsk Zakoniczyn; Kartuska
2 pokoje na PRZYMORZU;38.0;2;1;1967;380000;Gdańsk Przymorze; Jagiellońska
Mieszkanie Alfa Park - dostępne od zaraz do zamieszkania;54.0;2;2;2016;565000;Gdańsk Piecki-Migowo; MYŚLIWSKA 86
Idealna inwestycja po kapitalnym remoncie;59.68;4;3;1945;549000;Gdańsk Siedlce; Kartuska
2 pokoje, Przymorze, po remoncie;33.0;2;0;1975;425000;Gdańsk Przymorze; Rzeczypospolitej
3 pokoje, I pietro, balkon, super lokalizacja;50.0;3;1;1980;479000;Gdańsk Morena; Matuszewskiego
PENTHOUSE Z PIĘKNYM WIDOKIEM GDAŃSK PRZYMORZE;63.21;3;17;2015;830000;Gdańsk Przymorze; Rzeczypospolitej
2  niezależne pokoje;45.0;2;9;1967;389000;Gdańsk Młyniska; Mikołaja Reja
HL0709 - Klimatyczne mieszkanie w Oliwie!;76.0;2;2;1906;849000;Gdańsk Oliwa; Grunwaldzka
Garnizon 2 pokojowe z ogródkiem dla wymagających;44.0;2;0;NaN;675000;Gdańsk Wrzeszcz; Stachury
Mieszkanie - Gdańsk Przymorze, 389 000 zł;42.0;2;1;1966;389000;Gdańsk Żabianka; Lecha
Sprzedam apartament z ogródkiem w pobliżu Starówki;41.5;2;0;2019;649000;Gdańsk Długie Ogrody; Św. Barbary
Idealne, nowe M! Wokół zieleń!;42.0;2;2;2020;399000;Gdańsk Łostowice; Niepołomicka
Słoneczne 3 pokojowe mieszkanie na Wawelskiej;64.0;3;0;2006;575000;Gdańsk Chełm;
Matarnia/ 38m2/ stan idealny, przy TPK/negocjacje;38.0;2;1;NaN;319000;Gdańsk Matarnia - Rębiechowo; Mjr. Mieczysława Słabego
2 pokoje w atrakcyjnej lokalizacji;49.3;2;1;1950;485000;Gdańsk Wrzeszcz; Sochaczewska
Jasne 2 pokoje, Oliwa, blisko UG i biurowców;38.0;2;2;2018;550000;Gdańsk VII Dwór; Macierzy Szkolnej W Gdańsku
Przestronne mieszkanie 3-pok, Wiszące Ogrody;64.0;3;4;2008;550000;Gdańsk Jasień; Przytulna
Wyremontowana kawalerka wrzeszcz;28.020;1;6;NaN;399000;Gdańsk Wrzeszcz; Grunwaldzka
Mieszkanie - Gdańsk Jasień;61.8;3;1;2010;545000;Gdańsk Jasień; Kartuska
Umowa rezerwacyjna na mieszkanie - Alfa Park;49.88;3;3;2022;446426;Gdańsk Morena; gen. Władysława Andersa
Gdańsk Morena Piecki 3 pok. osobna kuchnia 63m super komunikacja.;63.0;3;4;1975;478000;Gdańsk Morena; Orańska
Jelitkowski Dwór garaż blisko morza;45.2;2;0;2005;549000;Gdańsk Przymorze; Anastazego Wika-Czarnowskiego
Mieszkanie 2 pokojowe blisko morza;45.0;2;2;1970;375000;Gdańsk Przymorze; Prezydenta Lecha Kaczyńskiego
Gdańsk Chełm 3 pokoje z windą świeżutko po kapitalnym remoncie!;49.5;3;5;1985;519000;Gdańsk Chełm; Biegańskiego 39
Zaspa - 3 pokoje - świetna lokalizacja;63.4;3;4;1980;569000;Gdańsk Zaspa; Stanisława Skarżyńskiego
Mieszkanie Gdańsk 42m2;42.0;2;3;1950;430000;Gdańsk Wrzeszcz; Lelewela
Posiadamy na sprzedaż bardzo atrakcyjny i komforto;46.0;2;3;2013;460000;Gdańsk Siedlce; Malczewskiego Jacka
Mieszkanie - Gdańsk Ujeścisko;42.19;2;1;2002;410000;Gdańsk Ujeścisko; Przemyska
Sprzedam mieszkanie 2 pokojowe Gdańsk Karczemki;51.6;2;3;2010;545000;Gdańsk Karczemki; Sympatyczna
Mieszkanie 3 pokojowe na Oruni Górnej;63.0;3;2;1990;385000;Gdańsk Orunia Górna; Uranowa
Dwupoziomowe mieszkanie na Morenie;94.9;3;3;2005;540000;Gdańsk Morena; Morenowe Wzgórze
Przestronna kawalerka w Kwartale Kamienic z tarasem;31.0;1;0;2013;550000;Gdańsk Śródmieście; Tandeta 1
Apartament 2 pokojowy - blisko morza;55.7;2;4;2019;724000;Gdańsk Brzeźno; Gen. Józefa Hallera
Przystań Letnica - mieszkanie dostępne od zaraz;61.27;3;1;2020;525161;Gdańsk Letnica; Letnicka
Przystań Letnica - mieszkanie dostępne od zaraz;82.84;4;1;2020;651625;Gdańsk Letnica; Letnicka
