tytul;powierzchnia;l_pokoi;pietro;rok_budowy;cena;miejsce;Ulica
Ul. Wajdeloty, 3-pokoje z możliwością 5;72.0;3;2;1930;569000;Gdańsk Wrzeszcz; Wajdeloty 1
Przymorze, apartament z pięknym widokiem;65.2;NaN;9;2020;899000;Gdańsk Przymorze; Obrońców Wybrzeża
Kawalerka w idealnej lokalizacji!;30.0;1;5;2007;360000;Gdańsk Zaspa; Stanisława Skarżyńskiego
3 pokoje Albat Mezzo OBC Alchemia;66.84;3;5;2020;736309;Gdańsk Przymorze; Krynicka 3a/46
Lokal użytkowy Wrzeszcz - Idealny na inwestycje.;34.0;2;0;1955;375000;Gdańsk Wrzeszcz; Wyspiańskiego Stanisława
Szybki odbiór - Wysoki standard - Słoneczne;46.5;2;3;2019;326079;Gdańsk Łostowice;
Mieszkanie 45 m2 - Pohulanka;45.0;2;3;2013;620000;Gdańsk Śródmieście; Pohulanka 8
Przytulne 2 pokojowe w nowej inwestycji-Łostowice;50.9;2;3;2017;399000;Gdańsk Łostowice; Hokejowa
Spółdzielcze Własnościowe prawo do Lokalu;30.0;1;1;1970;285000;Gdańsk Przymorze; Chłopska
Słoneczne mieszkanie z balkonem Gdańsk Morena;60.1;3;1;1986;495000;Gdańsk Morena; Heleny Marusarzówny
Kameralna inwestycja - Szybkie wydanie;54.5;3;2;2019;361059;Gdańsk Św. Wojciech; Borkowska
Ładne mieszkanie z ogródkiem, piwnicą oraz miejscem postojowym;39.9;2;0;2012;420000;Gdańsk Jasień; Morelowa
Mieszkanie - Gdańsk Aniołki;46.92;2;3;2020;530196;Gdańsk Siedlce; Powstańców Warszawskich
Gdańsk Stogi-2-pok ul.Hoża;35.0;2;4;1970;287000;Gdańsk Stogi; Hoża
Mieszkanie - Gdańsk Jasień;42.0;2;0;2014;395000;Gdańsk Szadółki; Lawendowe Wzgórze
Apartament 2-pokoje 43m2 przy Marinie;43.0;2;0;2019;649000;Gdańsk Długie Ogrody; Świętej Barbary
Ścisłe centrum! 2 pokoje, wysoki standard;38.0;2;3;2018;640000;Gdańsk Śródmieście; Tartaczna
Atrakcyjne trzypokojowe mieszkanie z ogródkiem;72.33;3;0;2012;520000;Gdańsk Szadółki; Stężycka
Duży ogród, 2-pokojowe na Jasieniu, blisko centrum;43.7;2;0;2012;415000;Gdańsk Szadółki; Morelowa
Przestronne / dobrze skomunikowane / ciche / ZASPA;62.5;3;1;1980;569000;Gdańsk Zaspa; Dywizjonu 303
3 pokoje, Jasień, nowe budownictwo;47.0;3;2;2016;387000;Gdańsk Rębowo; Kazimierza Leskiego
2 pokoje blisko Gdańskiej Starówki!;54.0;2;3;1905;499000;Gdańsk Długie Ogrody; Łąkowa
Wygodne mieszkanie dla rodziny lub pod wynajem!;49.0;2;1;1982;439000;Gdańsk Morena; Piecewska
2 oddzielne pokoje z balkonem Przymorze;43.0;2;3;1970;379000;Gdańsk Przymorze; Kołobrzeska
Przestronne mieszkanie 2-pok na Starym Mieście;71.0;2;3;1956;599000;Gdańsk Śródmieście; Podwale Staromiejskie
Jasne mieszkanie 2-pok;44.3;2;1;1920;279000;Gdańsk Orunia Dolna; Związkowa
Nowy Stylowy Apartament w Brzeźnie 600m do Plaży;41.5;2;4;2019;570000;Gdańsk Brzeźno; Gen. Józefa Hallera
Wyjątkowe, nowoczesne 3 pokoje, Łostowice;65.0;3;2;2009;489000;Gdańsk Łostowice; Hokejowa
Mieszkanie - Gdańsk Brzeźno;35.0;2;4;NaN;385000;Gdańsk Brzeźno; Hallera
Apartament dwupoziomowy wysoki standard, Szafarnia;90.0;3;0;2012;1190000;Gdańsk Długie Ogrody; Szafarnia
Kawalerka z widokiem na zatokę - ul. Karpacka, Oliwa;31.0;1;8;1980;359000;Gdańsk Oliwa; Karpacka 2
2 pokoje niski blok 2p/4p  Przymorze Małe PILNE;42.82;2;2;1970;341000;Gdańsk Przymorze; Jana Solikowskiego
1 pokój ,13 piętro z widokiem ! Przymorze;32.0;1;13;2020;499000;Gdańsk Przymorze; Obrońców Wybrzeża
Apartament w inwestycji RiverView 33m2 - Okazja;33.0;1;3;2019;495000;Gdańsk Długie Ogrody; Angielska Grobla
Mieszkanie 2-pokojowe 40,60m2 idealne pod inwestycje - Gdańsk Śródmieście;40.0;2;5;1975;435000;Gdańsk Długie Ogrody; Długie Ogrody
3 pokoje 42,7 m2 Plac Wybickiego Wrzeszcz;42.7;3;0;1950;498000;Gdańsk Wrzeszcz; Pl. Józefa Wybickiego
4 pokojowe mieszkanie w jednej z najbardziej pożądanych  dzielnic Gdańska Morena;80.0;4;1;2013;760000;Gdańsk Morena; Królewskie Wzgórze
Mieszkanie 2-pokoje 29,27m2 - bezpośrednio przy Marinie Gdańsk;29.0;2;3;2019;470000;Gdańsk Długie Ogrody; Świętej Barbary
Gotowe do wprowadzenia w odnowionej kamienicy;67.05;3;2;1898;569000;Gdańsk Dolne Miasto; Łąkowa
Gdańsk Śródmieście Czopowa;54.5;2;2;2014;850000;Gdańsk Śródmieście; Czopowa
DOSKONAŁA KAWALERKA NA ŻABIANCE!;28.050;1;3;1980;310000;Gdańsk Oliwa; Bitwy Oliwskiej
Piastowska66_58m2_3-pok.osobne;58.0;3;0;1956;495000;Gdańsk Przymorze; Piastowska
Idealna lokalizacja Quattro Towers;51.0;2;4;2011;665000;Gdańsk Wrzeszcz; Partyzantów
Mieszkanie - Gdańsk Jasień;44.67;2;0;2014;419000;Gdańsk Szadółki; Lawendowe Wzgórze
Świetna Lokalizacja, Morena 65m2 3 pokoje !;65.0;3;7;1993;560000;Gdańsk Morena; Bulońska
3 pokojowe mieszkanie na Morenie;59.1;3;1;1980;499000;Gdańsk Morena; Marusarzówny
Mieszkanie - Gdańsk Aniołki;80.0;3;2;NaN;1200000;Gdańsk Aniołki; Marsz. Ferdynanda Focha
2 Pokoje tuż przy Uniwersytecie Gdańskim;49.1;2;0;1960;417000;Gdańsk Strzyża; Grzegorza Fitelberga
Doskonałe pod działalność/dla niepełnosprawnych;46.0;2;0;1970;420000;Gdańsk Przymorze; Kołobrzeska
Mieszkanie Gdańsk Przymorze  44.5 m2;44.5;2;4;2020;569000;Gdańsk Przymorze;
Doskonała nieruchomość pod inwestycje!;67.7;5;0;NaN;550000;Gdańsk Zaspa; Dywizjonu 303
Mieszkanie w doskonałej lokalizacji!;105.57;3;3;2020;549900;Gdańsk Chełm; Pastelowa
3 pokoje na Siedlcach - WIDOK: panorama miasta;56.12;3;10;NaN;440000;Gdańsk Siedlce; Jacka Malczewskiego
94m2 4 pokoje OSOWA;94.0;4;1;2011;685000;Gdańsk Osowa; Nowy Świat
Gdańsk Przymorze mieszkanie 2 pokojowe sprzedam;41.0;2;2;1978;369000;Gdańsk Przymorze; Jagiellońska
Gdańsk Przymorze-3-pok ul.Chłopska;52.0;3;2;1975;489000;Gdańsk Przymorze; Chłopska
2 pokoje gotowe do odbioru | Nowoczesne osiedle;36.14;2;2;2020;269000;Gdańsk Łostowice; Niepołomicka
Osobna, duża kuchnia, balkon! Bardzo Słoneczne!;54.0;2;3;1960;599000;Gdańsk Wrzeszcz; Do Studzienki
Inwestycyjne mieszkanie w centrum!;66.0;2;2;1920;459000;Gdańsk Dolne Miasto; Stefanii Sempołowskiej
Nietuzinkowe wnętrze / 2 łazienki / widok na park;73.0;3;4;2019;1142700;Gdańsk Długie Ogrody; Św. Barbary
Mieszkanie 2-pokojowe Gdańsk Przymorze Blisko Morza;38.0;2;4;1970;380000;Gdańsk Przymorze; Jagiellońska
Dwa niezależne pokoje w Centrum Wrzeszcza;51.47;2;4;1980;455000;Gdańsk Wrzeszcz; Grunwaldzka
Wygodne mieszkanie dla rodziny lub pod wynajem!;49.0;2;1;1982;439000;Gdańsk Morena; Piecewska
Mieszkanie 3-pokojowe;58.0;3;6;2018;588000;Gdańsk Letnica; Starowiejska
Mieszkanie - Gdańsk Stare Miasto;46.0;2;3;2014;666000;Gdańsk Śródmieście; Tartaczna
Mieszkanie - Gdańsk Stare Miasto;87.0;3;3;NaN;1914000;Gdańsk Śródmieście; Chmielna
Mieszkanie 4-pok we Wrzeszczu;66.0;4;1;1960;540000;Gdańsk Wrzeszcz; Hallera
Mieszkanie - Gdańsk Maćkowy;45.67;3;0;NaN;389000;Gdańsk Orunia Górna; Starogardzka
Przytulne mieszkanie 2-pok Osiedle Horyzont;40.8;2;9;2005;500000;Gdańsk Przymorze; Obrońców Wybrzeża
Dom Szeregowy W Centrum Wrzeszcza;112.4;4;0;NaN;829000;Gdańsk Wrzeszcz; Własna Strzecha
Przytulne mieszkanie 2-pok. 5 min do Starówki;42.0;2;0;1960;405000;Gdańsk Śródmieście; Rzeźnicka
JASIEŃ/ 3 POKOJE/ OGRÓDEK/ DUŻY SALON;70.15;3;0;2014;561000;Gdańsk Jasień; Leszczynowa
SŁONECZNE, GOTOWE DO ZAMIESZKANIA, PIERWSZE PIĘTRO;48.0;2;1;2011;429900;Gdańsk Ujeścisko; Przemyska
UNIKATOWE W SERCU ŚRÓDMIEŚCIA;55.2;2;4;1953;699000;Gdańsk Śródmieście; Browarna
Aktualne. 2 pokoje w Brzeźno 500 metrów do plaży;27.0;2;4;1975;299000;Gdańsk Brzeźno; Dworska
Klimatyczne 3 Pokoje Gdańsk Śródmieście;68.3;3;3;1900;445000;Gdańsk Biskupia Górka; Biskupia
Spółdzielcze własnościowe trzypokojowe;57.62;2;4;1973;490000;Gdańsk Żabianka; Szyprów
W sercu Wrzezcza;73.7;3;1;1919;550000;Gdańsk Wrzeszcz; Marii Konopnickiej
Najlepszy adres w mieście!;41.19;2;6;2019;774372;Gdańsk Śródmieście; Chmielna
Dwie bardzo stylowe kawalerki- Wrzeszcz/Strzyża;35.7;2;0;NaN;560000;Gdańsk Strzyża; Grunwaldzka
Apartament trzypokojowy z widokiem na morze;64.0;3;12;2012;685000;Gdańsk Przymorze; Rzeczypospolitej
Wygodne mieszkanie dla rodziny lub pod wynajem!;49.0;2;1;1982;439000;Gdańsk Morena; Piecewska
Mieszkanie - Gdańsk Zaspa;65.0;3;3;NaN;580585;Gdańsk Zaspa; Skarżyńskiego
Śródmieście, mieszkanie 3-pokojowe w kamienicy. Blisko Młodego Miasta!;57.0;3;3;1918;515000;Gdańsk Śródmieście; Lisia Grobla
Gotowiec inwestycyjny, Wyspa Spichrzów;40.0;2;1;2017;630000;Gdańsk Stare Przedmieście; Jaglana
53m2 z ogródkiem nad Jeziorem Jasień;53.0;2;0;2011;519000;Gdańsk Jasień; Życzliwa
Apartament 87,56m2 Gdańsk Śródmieście - Taras 77m2;87.0;4;5;2018;1230000;Gdańsk Długie Ogrody; Długa Grobla
Apartament z 22 m2 tarasem- niesamowity widok!;67.0;3;6;2021;899000;Gdańsk Długie Ogrody; Św. Barbary
Apartament z klasą;31.080;1;0;2018;519000;Gdańsk Śródmieście; Panieńska
Mieszkanie na sprzedaż,stogi;46.0;3;1;1970;345000;Gdańsk Stogi;
Mieszkanie Gdańsk Przymorze  32 m2;32.0;1;13;2020;499000;Gdańsk Przymorze;
3 pokojowe mieszkanie idealne pod inwestycję.;56.0;3;1;1930;450000;Gdańsk Stogi; Jodłowa
Wyjątkowe I 5 pokoi, 100m2 I Balkon I Dwupoziomowe;100.0;5;3;2011;599000;Gdańsk Łostowice; Jana Kielasa
2 pokojowe mieszkanie do własnej aranżacji Gdańsk;42.0;2;4;1972;330000;Gdańsk Stogi; Tamka
Słoneczna kawalerka w idealnej lokalizacji!;30.0;1;5;2007;360000;Gdańsk Zaspa; Stanisława Skarżyńskiego
Słoneczne 2 pokoje Wrzeszcz Dolny;49.0;2;1;1970;485000;Gdańsk Wrzeszcz; Sochaczewska
2 pokojowe mieszkanie w bliskiej odległości do morza.;42.0;2;3;1978;345000;Gdańsk Przeróbka; Bajki
Przestronne 3 pokojowe blisko komunikacji;68.23;3;0;2016;885000;Gdańsk Przymorze; Szczecińska
Mieszkanie 63m2  5 pokoi;63.0;5;4;1980;449000;Gdańsk Morena; Warneńska
Możliwość 4 pokoi w Oliwie !;78.84;2;1;1902;650000;Gdańsk Oliwa; Grunwaldzka
Mieszkanie Gdańsk   92.4 m2;92.4;4;1;2019;1249000;Gdańsk;
Ekskluzywny apartament w Mila Baltica!;66.68;3;3;2017;1095000;Gdańsk Zaspa; Bolesława Chrobrego
Słoneczny Apartament | Riverview;28.070;1;3;2020;495000;Gdańsk Długie Ogrody; Angielska Grobla
Słoneczny Apartament 3-pokoje Gdańsk Morena 72m2;72.0;3;12;2012;849000;Gdańsk Morena; Piecewska
Słoneczne 3 pokoje Brzeźno;59.0;3;7;1980;575000;Gdańsk Przymorze; Kołobrzeska
Przestronne 2 pokoje w dobrej lokalizacji !;47.0;2;2;2009;449000;Gdańsk Morena; Morenowe Wzgórze
2 pokojowe mieszkanie gotowe do wprowadzenia Gdańsk Chełm;49.0;2;1;2010;478000;Gdańsk Ujeścisko; Rogalinska
Gotowy Apartament znakomity pod inwestycje;62.0;3;3;2015;730000;Gdańsk Stare Przedmieście; Toruńska
MORENA/2 POKOJE/WYSOKI STANDARD/PARKING;48.02;2;2;2019;530000;Gdańsk Morena; Morenowe Wzgórze
Bezposrednio - mieszkanie 2-poziomowe Bretowska Brama;168.0;11;9;2000;2100000;Gdańsk Strzyża; Słowackiego 69
Nowe 2-pokojwe mieszkanie- Gdańsk Łostowice;50.0;2;3;2020;399000;Gdańsk Łostowice; Złota
Kawalerka w świetnej lokalizacji.;34.1;1;5;2007;360000;Gdańsk Zaspa; Stanisława Skarżyńskiego
Zadbane (70m/3 pokoje) w sercu Gdańska;70.0;3;0;1901;699000;Gdańsk Dolne Miasto; Zielona
Deo plaza - luksus & widok;74.21;2;4;2019;2300510;Gdańsk Śródmieście; Chmielna
Deo plaza - prestiż & widok;103.42;3;4;2019;3309440;Gdańsk Śródmieście; Chmielna
Okazja! Mieszkanie 2 pokojowe - Gdańsk Jasień.;49.8;2;0;1998;435000;Gdańsk Jasień; Stolema
Sprzedam mieszkanie 2 pokojowe 47,3 m2;47.0;2;3;1957;370000;Gdańsk Nowy Port; Oliwska 81
Zamiana dom dopłata Chałubińskiego 50 Metrów 1 piętro 2 pokoje Winda;50.0;2;1;1983;420000;Gdańsk Chełm; Chałubińskiego 22
Fajne mieszkanie na zaspie;62.4;2;1;1970;570000;Gdańsk Zaspa; Dywizjonu 303
Gdańsk Brzeźno 2 pokoje niedaleko plaży;39.0;2;3;1975;420000;Gdańsk Brzeźno; Broniewskiego
Apartament blisko morza 32m2;32.0;1;3;2020;445000;Gdańsk Brzeźno; Hallera
Mieszkanie 3 pokojowe plus garaż;98.0;3;1;1900;849000;Gdańsk Wrzeszcz; Aldony
Gdańsk Wrzeszcz 3 pokoje;98.0;3;1;1900;849000;Gdańsk Wrzeszcz; Aldony
Gdańsk Przymorze - słoneczne studio;23.0;1;7;NaN;299000;Gdańsk Przymorze; Śląska
DWUPOZIOMOWE MIESZKANIE NA GRANICY GDAŃSKA/SOPOTU;148.8;3;0;1990;1450000;Gdańsk Oliwa; Józefa Czyżewskiego
Mieszkanie Gdańsk Łostowice Brylantowa 79 m2;79.0;4;1;NaN;539000;Gdańsk Łostowice; Brylantowa
Nowe mieszkanie z ogródkiem;80.0;4;0;2019;795000;Gdańsk Letnica; Starowiejska
3 pok w Jelitkowie Nowe Budownictwo Hala Garaż !;70.0;3;3;2005;949000;Gdańsk Jelitkowo;
Mieszkanie z klimatem w centrum Starego Miasta.;69.0;3;1;1955;599000;Gdańsk Śródmieście;
Nowa cena 3 pokojowe z balkonem, Żabianka;54.0;3;2;1972;510000;Gdańsk Żabianka; Szyprów
MIeszkanie 4-pokojowe, Gdańsk Zakoniczyn;77.0;4;2;2007;590000;Gdańsk Zakoniczyn; Kazimierza Porębskiego
Piękne mieszkanie- blisko morza !;54.0;3;3;2005;849000;Gdańsk Przymorze; Jelitkowski Dwór
Gdańsk Zaspa 3 pokoje;65.0;3;4;1991;579000;Gdańsk Zaspa; Stanisława Skarżyńskiego
Świetne 3 pokoje w kamienicy we Wrzeszczu!;74.0;3;1;1920;550000;Gdańsk Wrzeszcz; Marii Konopnickiej
2 pokojowy apartament Gdańsk Przymorze. SKM.;50.0;2;2;2007;585000;Gdańsk Przymorze; Szczecińska
Apartament w otoczeniu morza;62.79;3;6;2019;799000;Gdańsk Wrzeszcz; Grudziądzka
Wyjątkowa nieruchomość w doskonałym miejscu!;49.0;2;4;1991;420000;Gdańsk Siedlce; Lecha Bądkowskiego
Luksusowe 3 pokojowe mieszkanie na pięknym osiedlu.;52.4;3;3;2003;849000;Gdańsk Przymorze; Jelitkowski Dwór
Elegancki apartament we Wrzeszczu;72.0;3;2;2018;1025000;Gdańsk Wrzeszcz; Joachima Lelewela
Dwupoziomowy apartament, elegacki styl - centrum;147.8;6;4;1997;1199000;Gdańsk Siedlce;
Gdańsk Brzeźno 3 pok. z widokiem na morze !!!;77.26;3;5;1970;559000;Gdańsk Brzeźno; Mazurska
Zamieszkaj nad morzem 3 pokoje w mila baltica!;66.68;3;3;2017;1095000;Gdańsk Zaspa; Bolesława Chrobrego
Ekskluzywny apartament w mila baltica !;66.68;3;3;2017;1095000;Gdańsk Zaspa; Bolesława Chrobrego
Idealna inwestycja 240m od ulicy Długiej!;49.0;2;2;1960;499000;Gdańsk Stare Przedmieście; Rzeźnicka
Wrzeszcz, Garnizon - 2 Pokoje;37.9;2;2;2020;449850;Gdańsk Wrzeszcz; Bogusława Leśmiana
Ładne mieszkanie w niskim budownictwie;60.1;3;1;1986;495000;Gdańsk Morena; Heleny Marusarzówny
Dwa pokoje Gdańsk;37.0;2;2;NaN;269000;Gdańsk Orunia Dolna; Granitowa
Do zamieszkania-Zajezdnia Wrzeszcz, 3 pokoje, Gdańsk, Grudziądzka;60.9;3;6;2019;749000;Gdańsk Wrzeszcz; Grudziądzka
2 niezależne pok. na Przymorzu. Gotowiec;38.0;2;2;NaN;429000;Gdańsk Przymorze; Chłopska
Mieszkanie w przedwojennej kamienicy po remoncie!;73.4;3;1;1909;550000;Gdańsk Wrzeszcz;
Apartament 33,3m2 | Riverview;33.3;1;1;2020;495000;Gdańsk Długie Ogrody; Angielska Grobla
Mieszkanie - Gdańsk Jasień;64.1;3;1;2015;500000;Gdańsk Szadółki; Potęgowska
Mieszkanie - Gdańsk Przymorze;51.3;3;11;2017;720000;Gdańsk Przymorze;
Nowa niższa cena! Apartament Wrzeszcz;106.0;4;4;2007;1099000;Gdańsk Wrzeszcz; Hugo Kołłątaja
Na Sprzedaż Piękne mieszkanie w Osowej z dodatkami;59.0;2;2;2009;499900;Gdańsk Osowa; Międzygwiezdna
Na Sprzedaż Piękne mieszkanie w Osowej z dodatkami;59.0;2;2;2009;499900;Gdańsk Osowa; Międzygwiezdna
Świetnie zlokalizowana kawalerka w centrum - Zaspa;31.0;1;5;2007;360000;Gdańsk Zaspa; Skarżyńskiego
Mieszkanie - Gdańsk Oliwa;61.4;3;2;NaN;1399000;Gdańsk Oliwa; Opacka
Os. Gardenia/ 3 POKOJE/ UMEBLOWANE/ BLISKO TRAMWAJ;56.4;3;2;2011;510000;Gdańsk Jasień; Kartuska
Gdańsk Chełm 3 pok, 63,5m2, 2 piętro!!!;63.5;3;2;1992;489000;Gdańsk Chełm; Zamiejska
2 poziomy/ umeblowane/ przy alei havla;54.0;2;4;2001;499000;Gdańsk Ujeścisko; Przemyska
Apartament nad samym morzem - Neptun Park;78.5;3;3;2009;1530750;Gdańsk Jelitkowo; Wypoczynkowa
GOTOWIEC W NOWYM PORCIE;43.57;2;0;NaN;374000;Gdańsk Nowy Port; Na Zaspę
Mieszkanie Gdańsk 60m2;60.0;2;1;1965;498000;Gdańsk Wrzeszcz; Bolesława Chrobrego
Penthouse w Śródmieściu z tarasem 77 m2;87.56;4;5;2018;1230000;Gdańsk Śródmieście;
Jasne mieszkanie 2-pok;44.3;2;1;1920;279000;Gdańsk Orunia Dolna; Związkowa
Komfortowe mieszkanie na Jasieniu;39.0;2;1;2015;390000;Gdańsk Szadółki; Lawendowe Wzgórze
Gdańsk Stare Miasto - komfortowy apartament;32.0;2;3;NaN;499000;Gdańsk Śródmieście; Złotników
Słoneczne mieszkanie- 3 oddzielne pokoje;57.54;3;6;2021;695000;Gdańsk Długie Ogrody; Św. Barbary
Kawalerka w Oliwie;27.0;1;0;1907;279000;Gdańsk Oliwa; Józefa Czyżewskiego 26
2pokoje z halą w cenie/ winda/ 58m2;58.0;2;2;2009;500000;Gdańsk Osowa; Międzygwiezdna
NIETUZINKOWA KAWALERKA W SAMYM SERCU OLIWY!!;31.55;1;1;1980;350000;Gdańsk Oliwa; Polanki
Dwa niezależne apartamenty inwestycyjne, 14% ROI.;65.0;3;1;2014;849000;Gdańsk Stare Przedmieście; Toruńska
Stylowe mieszkanie na Osowej;58.6;2;2;NaN;500000;Gdańsk Osowa;
Perełka inwestycyjna Gdańsk Śródmieście;28.080;1;0;NaN;269000;Gdańsk Śródmieście;
Żabianka. Mieszkanie w świetnej lokalizacji;54.0;3;2;NaN;495000;Gdańsk Żabianka; Szyprów
Nietuzinkowe mieszkanie po generalnym remoncie;86.97;3;1;1930;559000;Gdańsk Nowy Port; Ks. Mariana Góreckiego
Dwu pokojowe Mieszkanie, na Siedlcach;49.0;2;4;1981;420000;Gdańsk Siedlce; Lecha Bądkowskiego
INPRO/ 2 POKOJE/ DUŻA KOMÓRKA I OGRÓDEK;39.2;2;0;2011;349000;Gdańsk Szadółki; Morelowa
2 POKOJE/ GARNIZON/ WYSOKI STANDARD/ OGRÓDEK;48.0;2;0;2019;681000;Gdańsk Wrzeszcz; Bolesława Leśmiana
4-pokojowe mieszkanie z widokiem na Motławę!!;86.6;4;1;1955;1240000;Gdańsk Śródmieście; Powroźnicza
Inwestycja 82 m2 podzielone na 2 mieszkania Dekpol;81.09;4;0;2019;799900;Gdańsk Morena;
Dwupokojowe w ścisłym centrum Śródmieścia;48.0;2;2;1950;576000;Gdańsk Śródmieście; Jana Heweliusza
Przytulne ,ładne i bardzo ustawne mieszkanie;62.0;3;2;1992;444000;Gdańsk Osowa; Wodnika
3-pokojowe mieszkanie w pasie nadmorskim, Brzeźno;54.2;3;0;NaN;405000;Gdańsk Brzeźno; Dworska
2 pok po remoncie ZASPA;49.0;2;7;1975;440000;Gdańsk Zaspa; Dywizjonu 303
2 - poziomowe, słoneczne, chełm;112.0;5;2;1990;649000;Gdańsk Chełm; Lotników Polskich
2pokoje Przymorze. Potencjał inwestycyjny;46.3;2;5;NaN;399000;Gdańsk Przymorze; Obrońców Wybrzeża
Centrum Gdańska 4 pokoje 97,27 m2 z balkonem;97.27;4;2;1912;820000;Gdańsk Długie Ogrody; Mariana Seredyńskiego
2-POKOJOWE MIESZKANIE Z OGRÓDKIEM GARIZON;47.81;2;0;2020;696000;Gdańsk Wrzeszcz; Bolesława Leśmiana
2 Pokojowe Mieszkanie Po Generalnym Remoncie !!;31.0;2;5;NaN;325000;Gdańsk Przymorze; Obrońców Wybrzeża
Mieszkanie Gdańsk 52m2;52.0;2;7;2008;545000;Gdańsk Suchanino; Noskowskiego
Mieszkanie 3-pok. Gdańsk Oliwa - perełka!;92.22;3;2;1906;620000;Gdańsk Oliwa; Pomorska
Duże mieszkanie 3 pokojowe - UMEBLOWANIE W CENIE !;62.84;3;2;1965;565000;Gdańsk Wrzeszcz; Partyzantów
Mieszkanie Gdańsk Orunia  45 m2;45.0;2;1;NaN;285000;Gdańsk Orunia;
Apartament w najbardziej pożądanej lokalizacji!;76.37;4;3;2014;939000;Gdańsk Zaspa;
Zamieszkaj w kamienicy nieopodal Starego Miasta;73.5;4;1;1903;619000;Gdańsk Śródmieście; Kotwiczników
Gdańsk Zaspa Po Remoncie 2 pokoje;31.0;2;4;1970;330000;Gdańsk Zaspa;
Zamieszkaj w samym sercu Gdańska!;90.0;3;2;1931;749000;Gdańsk Długie Ogrody; Jana Dziewanowskiego
Zamieszkaj z rodziną nieopodal plaży;75.2;4;2;1993;699000;Gdańsk Zaspa; Jana Pawła Ii
2 pokojowe mieszkanie w Gdańsku Zaspa blisko plaży;55.4;2;1;1996;536000;Gdańsk Zaspa; Jana Pawła Ii
Centrum Gdańsk Wrzeszcza - 2 pokoje!;33.7;2;0;1955;379000;Gdańsk Wrzeszcz; Stanisława Wyspiańskiego
Luksusowy apartament | blisko morza;65.06;3;1;2019;780720;Gdańsk Brzeźno; Gen. Józefa Hallera
Jasień ul. Jasińskiego 1/2 pokoje + ogródek Prowizja 0%;38.2;2;0;2020;289000;Gdańsk Jasień; Jasińskiego 63
Luksusowy apartament | świetna lokalizacja;57.96;3;1;2019;695520;Gdańsk Brzeźno; Gen. Józefa Hallera
Mieszkanie 2 pokoje, Orunia Górna;63.1;3;2;1990;385000;Gdańsk Orunia Górna; Uranowa
Apartament w centrum Gdańska;56.79;3;3;2018;720000;Gdańsk Długie Ogrody; Długa Grobla
Mieszkanie 2 pokoje, Gdańsk Ujeścisko;49.3;2;3;2002;379000;Gdańsk Ujeścisko; Częstochowska
Mieszkanie na Przymorzu - blisko morza;30.0;1;1;1970;289000;Gdańsk Przymorze; Chłopska
Elegancki apartament z ogródkiem;33.65;2;1;2020;550000;Gdańsk Letnica; Sucha
Kawalerka Gdańsk Zaspa-Osiedle zamknięte;31.0;1;5;2007;360000;Gdańsk Zaspa; Stanisława Skarżyńskiego
Nietuzinkowy, panoramiczny widok na miasto!;84.38;3;12;2013;1100000;Gdańsk Wrzeszcz; Partyzantów
2 pokoje, nowe mieszkanie, atrakcyjna cena;46.22;2;3;2019;385000;Gdańsk Łostowice; Niepołomicka
KAWALERKA / RIVERVIEW / WYSOKI STANDARD;33.3;1;3;2019;495000;Gdańsk Długie Ogrody; Angielska Grobla
Kawalerka, Gdańsk Ujeścisko;32.0;1;1;2009;284000;Gdańsk Ujeścisko; Częstochowska
Kawalerka Gdańsk Wrzeszcz;25.0;1;4;1970;278900;GDAŃSK Wrzeszcz; Mickiewicza
Mieszkanie, 2 pokoje, Gdańsk Przymorze;44.5;2;2;1077;429000;Gdańsk Przymorze; Lęborska
Przestronny apartament w centrum Gdańska;54.0;2;0;NaN;690000;Gdańsk Stare Przedmieście; Lastadia
Gdańsk Śródmieście Toruńska;48.29;2;5;2020;726494;Gdańsk Śródmieście; Toruńska
świetna lokalizacja, znakomita cena;63.9;3;3;1994;399900;Gdańsk Jasień; Pólnicy
3 pokojowe mieszkanie na Osiedlu Cztery Pory Roku;64.8;3;0;2004;449000;Gdańsk Łostowice; Olimpijska
Komfortowy Apartament Rezydencja Marina Jelitkowo;85.0;3;1;2011;1350000;Gdańsk Przymorze; Czarny Dwór
Komfortowe, dwupokojowe - Gdańsk;50.0;2;3;2012;469000;Gdańsk Zakoniczyn; Konrada Guderskiego
Świetne warunki dla rodziny, 120m2 w Gdańsku;86.22;5;3;2011;599000;Gdańsk Łostowice;
Mieszkanie z ogrodem 340m2;88.0;4;0;2009;999000;Gdańsk Morena; Myśliwska
3 pokoje z tarasem i widokiem na zieleń i jezioro!;63.2;3;1;2011;539000;Gdańsk Jasień; Życzliwa
Okazja! Kawalerka/ Zaspa blisko SKM i UG;31.0;1;1;1975;299000;Gdańsk Zaspa; Pilotów
Mieszkanie - Gdańsk Morena;48.9;2;1;1980;418000;Gdańsk Morena; Warneńska
2 Pokoje/Żabianka/Blisko morza i SKM;37.4;2;4;1975;380000;Gdańsk Żabianka; Pomorska
Dwu pokojowe mieszkanie idealne na Wynajem;38.0;2;4;1970;399000;Gdańsk Przymorze; Jagiellońska
Mieszkanie dla rodziny lub inwestycyjnie.;83.0;3;3;1960;669000;Gdańsk Śródmieście; Brygidki
Okazja!Riverview-mieszkanie gotowe do wprowadzenia;33.3;1;3;2019;495000;Gdańsk Długie Ogrody; Angielska Grobla
Słoneczne mieszkanie z ogródkiem 30 m2;39.82;2;0;2010;435000;Gdańsk Morena; Myśliwska
2 pokoje z pięknym widokiem;38.0;2;10;1978;369000;Gdańsk Przymorze; Obrońców Wybrzeża
Ekskluzywne 2 pokoje na Toruńskiej na sprzedaż;61.0;2;6;2016;820000;Gdańsk Stare Przedmieście; Toruńska
Mieszkanie 3 pokojowe 59,60m2 0  2 balkony OTBS - partycypacja !;59.6;3;0;NaN;140000;Gdańsk Rębowo; Czermińskiego
Śródmieście kawalerka- inwestycja OLD NOVA;31.080;1;0;2018;519000;Gdańsk Śródmieście; Panieńska
Mieszkanie - Gdańsk Wrzeszcz Górny, 649 000 zł;81.37;3;3;1920;649000;Gdańsk Wrzeszcz; Ludwika Waryńskiego
Apartament gotowy do odbioru - angielska grobla!;89.61;4;5;2017;950000;Gdańsk Długie Ogrody; Szafarnia
Piękne mieszkanie 3 POK! żabianka 1,5 km od morza;66.7;3;2;1980;630000;Gdańsk Żabianka; Pomorska
Mieszkanie - Gdańsk Chełm;27.010;1;0;2006;259000;Gdańsk Ujeścisko; Nieborowska
Mieszkanie - Gdańsk Stogi, 289 000 zł;35.44;1;0;1997;289000;Gdańsk Stogi;
Piękne mieszkanie, 3 pok. balkon, centrum Gdańska!;65.12;3;2;1960;689000;Gdańsk Śródmieście; Kartuska
3 pokoje we Wrzeszczu;93.57;3;1;1924;780000;Gdańsk Wrzeszcz; Gen. Józefa Fiszera
2 pokoje blisko morza!;46.0;2;5;1970;389000;Gdańsk Przymorze; Piastowska
Super inwestycja ROI 7,27% - blisko Starego Miasta;56.12;5;6;1984;495000;Gdańsk Siedlce; Szara
OSIEDLE 2012 ROKU/ 3 POKOJE/ OSIEDLE KLIMATY;63.0;3;3;2012;579000;Gdańsk Jasień; Myśliwskie Wzgórze
Gdańsk Wrzeszcz Wrzeszcz;50.0;2;0;2020;710500;Gdańsk Wrzeszcz; Wrzeszcz
Stan idealny - widok na motławę;60.0;3;2;2009;839900;Gdańsk Stare Przedmieście; Toruńska
Inwestycja gdańsk, apartament z najemcą;53.5;2;1;2018;615000;Gdańsk Długie Ogrody; Św. Barbary
Apartament inwestycyjny Gdańsk Starówka;53.5;2;2;NaN;615000;Gdańsk Długie Ogrody; Św. Barbary
3 Pokoje Przymorze! Blisko UG! Pewny wynajem !;48.0;3;1;1970;460000;Gdańsk Przymorze;
Piastowska66_58m2_3-pok. osobne;58.0;3;0;1956;495000;Gdańsk Oliwa; Piastowska
Sprzedam mieszkanie 51 m2 Gdańsk Morena Os. Trzy dęby;51.0;2;1;2005;550000;Gdańsk ;Piekarnicza 23 lok 8
Chełm, przytulne 2 pokoje z dużym tarasem;43.6;2;0;2012;399000;Gdańsk Ujeścisko; Łańcucka
Nowe, 2 pok mieszkanie w zielonej dzielnicy Jasień;40.95;2;4;2020;350000;Gdańsk Szadółki; Lawendowe Wzgórze
Gdańsk Oliwa Obrońców Westerplatte;63.5;3;3;1901;569000;Gdańsk Oliwa; Obrońców Westerplatte
Gdańsk, Śródmieście, Świetna inwestycja;40.6;2;5;NaN;435000;Gdańsk Długie Ogrody; Długie Ogrody
Słoneczne mieszkanie na Brzeźnie;35.3;2;4;NaN;385000;Gdańsk Brzeźno; Gen. Józefa Hallera
Spacerem po starówce Gdańska;52.0;2;1;1962;572000;Gdańsk Śródmieście;
Apartament dla konesera;140.0;3;5;2019;1560000;Gdańsk Stare Przedmieście; Kotwiczników
Super mieszkanie na Przymorzu;38.0;2;0;1976;399000;Gdańsk Przymorze; Obrońców Wybrzeża
Mieszkanie - Gdańsk Borkowo;75.0;4;0;2015;609000;Gdańsk Strzyża; Żeglarska
2 pokoje Jasień ! Miejsce parkingowe!;39.6;2;1;2015;410000;Gdańsk Jasień;
Komfortowy apartament - Zajezdnia Wrzeszcz;75.54;3;2;2018;1100000;Gdańsk Wrzeszcz; Grudziądzka
Urządzone z ogrodem, 3 pokoje, Gdańsk-Przymorze, bez prowizji;68.21;3;0;2017;860000;Gdańsk Przymorze; Beniowskiego
Os. GARNIZON/ 2 POKOJE/ STYL SKANDYNAWSKI;50.66;2;3;2017;700000;Gdańsk Wrzeszcz; Cypriana Kamila Norwida
Dwupokojowe ustawne Gd. Morena, duża loggia!;49.0;2;1;1987;429000;Gdańsk Morena; Związku Jaszczurczego
Mieszkanie Gdańsk 45m2;45.0;2;2;1950;410000;Gdańsk Wrzeszcz; Zbyszka Z Bogdańca
Mieszkanie - Gdańsk Orunia;40.5;2;0;1925;220000;Gdańsk Orunia; Trakt Św. Wojciecha
3 pokoje z balkonem i miejscem w hali, przymorze;69.48;3;3;2007;835000;Gdańsk Przymorze; Gen. Bora-Komorowskiego
Mieszkanie na sprzedaż z widokiem na Wisłę;71.0;3;1;NaN;290000;Gdańsk Śródmieście; Świbnieńska
Wyjątkowe dwa pokoje w samym sercu Starego Miasta;42.0;2;4;1968;569000;Gdańsk Śródmieście; Grobla I
